{
  "character_id": "0191b2a0-0000-7000-8000-0000000c0002",
  "version": 1,
  "default_level": "해요체",
  "self_reference": "mixed_by_level",
  "by_counterpart": [
    {
      "counterpart": { "entity_id": "0191b2a0-0000-7000-8000-0000000c0001" },
      "level": "해요체",
      "address_terms": ["도윤 씨"],
      "honorific_subject": false,
      "valid_from_chapter": 10,
      "valid_to_chapter": 86,
      "note_ko": "정중하지만 거리감. 87화 관계 전환 전까지 유지."
    },
    {
      "counterpart": { "entity_id": "0191b2a0-0000-7000-8000-0000000c0001" },
      "level": "해체",
      "address_terms": ["도윤"],
      "honorific_subject": false,
      "valid_from_chapter": 87,
      "note_ko": "연인 관계 진입 후 반말. 공식 석상에서는 해요체 유지(public_formality)."
    },
    {
      "counterpart": { "entity_id": "0191b2a0-0000-7000-8000-0000000c0003" },
      "level": "해요체",
      "address_terms": ["무진 선배님"],
      "honorific_subject": true
    },
    {
      "counterpart": { "entity_id": "0191b2a0-0000-7000-8000-0000000c0004" },
      "level": "해요체",
      "address_terms": ["부길드장님"],
      "honorific_subject": true,
      "note_ko": "23화 이후 표면상 유지, 40화 이후 냉랭함이 어휘에 드러남(화계는 동일)."
    },
    {
      "counterpart": { "entity_id": "0191b2a0-0000-7000-8000-0000000c0005" },
      "level": "해체",
      "address_terms": ["유리"],
      "valid_from_chapter": 13,
      "note_ko": "13화에 유리가 '언니'라고 부른 뒤부터 반말."
    },
    {
      "counterpart": { "class": "stranger" },
      "level": "해요체",
      "address_terms": ["헌터님", "선생님"]
    }
  ],
  "tics": ["임상적 어휘(출혈량, 회복 속도 등)를 일상 대화에 섞는다", "가족 이야기가 나오면 화제를 돌린다"],
  "forbidden_expressions": ["아버지"],
  "register_shift_rules": [
    { "trigger": "public_formality", "shift_to": "해요체", "note_ko": "87화 이후에도 공식 석상에서는 도윤에게 해요체" },
    { "trigger": "anger", "shift_to": "하십시오체", "note_ko": "화가 나면 오히려 더 딱딱하게 격식체로 굳는다" }
  ],
  "sentence_tendency": { "length": "medium", "onomatopoeia": "none", "vocabulary_ko": "임상 용어, 절제된 표현" },
  "voice_exemplar_ids": []
}
